professor,comment,rating,tags
Anne Burkus-Chasson,"Took GCL 129 but was nothing as advertised in the course explorer. The class required 5 books that weren't even widely used. The professor lacked the knowledge to connect the course to what she was trying to explain to the students. 4 main papers, one group project, and a heavy focus on sinology. Her grading is harsh but will negotiate.",1.0,Get ready to read|SO MANY PAPERS|GROUP PROJECTS
Anne Burkus-Chasson,"GCL129 was not what was advertised on course explorer -- focused on design as in art, not buildings and infrastructure (what I expected). However, had a good time in class. However, she really grades based on how much she likes you, not very subjective. If you participate and engage with her, you should have an easy time.",4.0,Get ready to read|Participation matters|SO MANY PAPERS
Anne Burkus-Chasson,"Professor Burkus is genuine, kind, and extremely knowledgeable. She really cares about her students and her classes are very engaging.",5.0,Inspirational|Caring
Jennifer Burns,"Jennifer is an amazing human being. She knows her stuff, is accessible, and is interested in her student's well-being and practice.",5.0,Respected|Accessible outside class|Inspirational
Jennifer Burns,The lecturer is not inspirational at all conducting dull lectures and useless materials. She is also extremely harsh to students without any caring mind. Do not ever consider her courses. She is the worst professor ever!,1.0,Lots of homework|Lecture heavy|Tough grader
Jennifer Burns,"Really good professor, passionate and she knows what she is talking about. Caring. Happy to have taken her class.",5.0,Gives good feedback|Participation matters|ACCESSIBLE OUTSIDE CLASS
Jennifer Burns,"really effort on making class clear and cares about , exams , people . Really good theoric classes.",5.0,Participation matters|Amazing lectures|Caring
Jose Capino,"Prof. Capino was a solid professor. For the first few weeks of class, he kept encouraging students to drop the course, and many listened. Regardless, he was a good teacher. Every Tues, there was a pop quiz on the reading (which I never did) and movie (which were pretty decent to watch). There were 2 papers, 1 exam, and 1 group media project.",4.0,Get ready to read|Participation matters|Beware of pop quizzes
Jose Capino,Good Professor! Never boring. Was a little unclear on exam expectations. The exam questions would be a bit too open-ended. Studying for exams was a bit difficult but overall a great class.,5.0,BEWARE OF POP QUIZZES|Hilarious|Amazing lectures
Jose Capino,I got a lot out of this class because the lectures were very informational and enjoyed 80% of the movies.,4.0,Skip class? You won't pass.|BEWARE OF POP QUIZZES|Hilarious
Ira Carmen,An unforgettable professor.  Everybody knows that Professor Carmen is one of the best (if not THE best) professors in the history of the Political Science Department at the U of I.  A legend.,5.0,Tough Grader|Respected|Amazing lectures
Brenden Carollo,Class experience depends on TA because students never had one interaction with Brenden unless it was an email. Lack of communication about class expectations and grading criteria which makes it difficult to enjoy the class. Homework isn't bad just frequent.,2.0,Participation matters
Brenden Carollo,"The absolute best class I have taken so far. Carollo is so helpful and does a great job at explaining things when the class is confused. Altough the class was on zoom (due to COVID) I still felt very connected and loved the participation aspect of the class. As long as you pay attention and do the work, you should get a good grade.",5.0,Gives good feedback|Participation matters|Caring
Brenden Carollo,"Never saw Carollo. Class 100% TA taught meaning experience relies heavily on them. My TA was amazing, so the class was very easy. Can't speak to other sections yet this class is far easier than 142, given its vocab heavy, grammar light nature. Tests are very easy to study for, and there are no surprises as to what is on midterm/final.",2.0,Participation matters|LOTS OF HOMEWORK|Clear grading criteria
Brenden Carollo,"Absolutely loved Professor Carollo! He genuinely cared about his students and made sure they understood the material. Always responded to emails fairly quickly. Also, he is always available to help you during office hours!",5.0,Respected|Participation matters|Caring
Brenden Carollo,"Prof. Carollo is an amazing professor for SPAN142! His method of the hybrid class, where you do preparation for the next class, really helped me learn. I took 3 years of Spanish in high school but a lot of it came back to me easily. It takes some work and can be long, but his classes are easy to understand and sometimes fun!",4.0,Gives good feedback|Skip class? You won't pass.|LOTS OF HOMEWORK
Brenden Carollo,Great professor. Learned a lot.,5.0,Respected|Inspirational|Hilarious
Brenden Carollo,"I have no idea why this professor has such a bad rating; he's been one of my favorites. He encourages class participation, is excellent at explaining, and is really accommodating. He does NOT have an ego - in fact, he often makes fun of himself in class! Attend class, do the homework, and you'll pass.",5.0,Skip class? You won't pass.|LOTS OF HOMEWORK|Clear grading criteria
Brenden Carollo,"He explains the grammar questions I have pretty well, and he speaks slowly so that everyone can understand him.",5.0,Gives good feedback
Thomas Carty,"He's actually laughably bad at explaining stuff, and does i clicker things for credit he expects you to know the material before you even enter the class. he gives a week notice before midterms, it's actually ridiculous he makes an easy as heck class hard",1.0,Test heavy
Tom Carty,"This class was awful. It began with numerous passive agressive emails, along with tests that were inconcievably long for the given time, and ended with a badly managed online version due to the switch to online school. This teacher manager to be both rude and difficult to learn from. Do not take this class if you have the option.",1.0,Lots of homework|Tough grader
Tom Carty,"Where to begin with this guy. He doesn't listen to his students and is outright rude to them. His tests are nothing like anything you could study out of the book to prepare yourself. This is the only class I've ever failed. Avoid at all costs, even if it means sacrificing a semester of math requirements.",1.0,Tough grader
Francesco Cellarosi,"One of the best professors I've had at UIUC. Genuinely enthusiastic, both about the subject and about his students learning. Somehow made learning calculus somewhat enjoyable. Class was tough, but that's to be expected from Calc III.",5.0,Respected|Inspirational|ACCESSIBLE OUTSIDE CLASS
Geoffrey Challen,"Class is moderate hard and so as the quiz, but like this professor so much that this is actually the first time that I figure how to code.",5.0,Gives good feedback|Respected|Lots of homework
Geoffrey Challen,"I've graded him once before and now my opinion has changed. Quizzes are practically hard and homework can be tough to decipher. Says that you can succeed even with no experience, but I strongly think that you must have extensive knowledge of computer science to pass this class. Do not take this course if you have no experience.",1.0,EXTRA CREDIT
Geoffrey Challen,"One time I entered Professor Challen's Zoom office hours to get help setting up my MP, and he chastised me for interrupting his ""social hours"" with the students (I was the only one in the room). He teaches CS concepts very well and definitely knows his stuff, but I don't like him personally.",2.0,Respected|Lots of homework
Geoffrey Challen,"Geoff is what I wish every instructor was. His lessons cover absolutely everything you need to succeed, replies instantly on the forum, cares about the success of the students, grants extensions, and encourages you every step of the way. The learning environment for CS 125 is set up extremely well to provide you with all the help you need to learn.",5.0,Respected|Skip class? You won't pass.|Caring
Geoffrey Challen,"The class website is good, but the quizzes are a little hard and the MPs are downright impossible for people who are beginners at coding and completely disconnected from what we are learning in regular lessons. Would most certainly not recommend for beginners despite the fact that this is an ""intro"" course. Getting an A is a struggle.",2.0,Lots of homework|Clear grading criteria
Geoffrey Challen,"Most people I know either love or hate Challen. I'm in the first camp. He's the best professor I've had at UIUC. Challen is extremely well organized. He is upbeat and intelligent. I'd never coded before taking CS125, and I'm getting an A. If you actually take the time to study the daily lessons then the homeworks and mps are pretty easy.",5.0,Lots of homework|Get ready to read|Skip class? You won't pass.
Geoffrey Challen,Awesome class,5.0,Respected|Inspirational|Amazing lectures
Geoffrey Challen,"By far my favorite professor at UIUC so far! The daily lectures were perfectly paced and interactive! Having taken another CS class that isn't going as well, I really miss the structure of CS 125. Super easy to get feedback on MPs or general help with the content.",5.0,Inspirational|Amazing lectures|Caring
Geoffrey Challen,I took this course because it was supposed to be an introduction to computer science. However this class expects you to already be experienced with thinking like a programmer beforehand. I ended up spending hours on homework that should have taken a few minutes at most. Quizzes are very difficult and MPs are even worse.,2.0,Lots of homework|Skip class? You won't pass.|Lecture heavy
Geoffrey Challen,Geoff doesn't like students sending him individual emails but it makes sense because you can literally get the same questions answered on the forum in 5 minutes or less by him or by the staff. His lectures are very thorough and helpful and he's very passionate and knowledgeable about CS. Great professor who's always got your back.,5.0,Lots of homework|Lecture heavy
Geoffrey Challen,"He is the best professor I ever met, really. The daily practice is great. The Mp is a little bit hard, but if you work hard and spend enough time it would be great. However, the quizzs and exams are hard, if you want A, you need to pay more attention to the homework and Mps.",5.0,Respected
Geoffrey Challen,"He is the best. MPs and weekly quizs could be tough, but you'll be OK.",5.0,Inspirational|Clear grading criteria|Amazing lectures
Geoffrey Challen,He is a very good professor and he knows how to help his students very well. I was brand new to programming and this class really helped make me understand it more. The class is a lot of work and you need to watch the walkthroughs the Professor puts online to understand what is happening in the class.,5.0,Respected|Inspirational|Lecture heavy
Geoffrey Challen,"Geoff's teaching style is incredibly clear and concise. The daily lessons are structured well in content and also delivery. I admit, for someone truly coding for the first time - the course will take you 1-2 hours every day. If coding isn't for you, however - it's best you realize it as soon as possible. (class median: 93)",5.0,Lots of homework|Amazing lectures
Geoffrey Challen,"I was definitely a beginner in CS, but Geoff is an extremely caring professor and does a really good job of explaining all of the material. The class is hard though, with homework due every day and five lectures a week. Luckily the class is well organized and has lots of office hours, but even still the quizzes and MP are a real pain.",5.0,Lots of homework|Lecture heavy|Caring
Geoffrey Challen,"If I have to rate him in detail I would give a 4.8 for him, but there is no option for it. He's the one of the best instructors I have for fall 2020. The workload is really heavy since there are 5 lectures per week and also a HW followed after the lecture. The only bad thing about this course is the machine project. Would be better if he removes it",5.0,Lots of homework|Test heavy|Lecture heavy
Geoffrey Challen,The best CS prof to ever exist :-),5.0,Respected|Inspirational|Amazing lectures
Geoffrey Challen,"Geoff is a great lecturer. He made you work for the class. Though the MPs are hard and extremely time-consuming, it was all worth the timeone of the best courses I have ever taken at UIUC. You would learn a great deal from the class. Take the class if you have time and are ready for some challenges.",5.0,Lots of homework|Inspirational|Clear grading criteria
Geoffrey Challen,"Excellent guy! He wants every student to succeed and will do whatever it takes for them to appreciate the subject. The class has a good mix of fun and hard work. Put some effort and I guarantee youll get an A and even pursue this field for life. Do take this class, even if you have nothing to do with CS.",5.0,Inspirational|Clear grading criteria|Caring
Geoffrey Challen,"The class was straightforward. Go to lecture, do the daily homework, start MPs early, go to office hours and ask questions. This is not a low-time class, but it's very worth it. You definitely need to go to office hours to finish the MPs . The homework was incredible. Wish I still had access to the homework problems honestly.",5.0,Lots of homework|Participation matters|Clear grading criteria
Geoffrey Challen,Fantastic teacher and human being. He really cares that students succeed and has organized CS 125 with daily homework assignments that really reinforce the concepts. Super innovative approach that I wish more of my other professors would take with the online forum and mobilizing such a large course staff. You will learn so much in this class!!,5.0,Accessible outside class|Inspirational|Caring
Geoffrey Challen,Geoff is a super great teacher and really cares about his students. I had almost no prior coding experience coming into the course so the quizzes and MPs were very challenging to me. This class is definitely hard.,5.0,Lots of homework|Accessible outside class
Geoffrey Challen,The MPs are irrelevant to the lectures and the prof is not good at teaching. Either he has typos in the ppts or he would just mention sth and say that we would learn about that later and then never talks about it again.,2.0,Lots of homework|Participation matters
Geoffrey Challen,"Great professor, very passionate about CS materials and thinks for his students. I was a beginner in programming and I did have a bad time in the first few weeks, but it's not hard once you get used to it.",4.0,Respected|Accessible outside class
Geoffrey Challen,Geoff is really nice and he's passionate about computer science! This class requires a fair amount of work but it's an easy A as long as you do your work. The MP of this semester is harder than previous ones but he gave an extra drop for MP and apologize in class. I went to his office hour once and we had a really nice conversation.,5.0,Lots of homework|Participation matters|EXTRA CREDIT
Geoffrey Challen,"It is very easy to get an A/A+ in his class, but there is a decent amount of work to be done. HW problems everyday and MPs biweekly. If you put in the work, you will get an A guaranteed.",4.0,Respected|Lots of homework|Accessible outside class
Geoffrey Challen,"This man is strong-minded, but won't act on impulse. We made an APP to recommend easy gen-eds, and while Geoff doesn't personally like the idea, he gave fair feedbacks of our project. He moves the class a bit fast, making the 4-credit-hour-class appearing like 6, but his lectures are decent. About MPs - beginners have to go to office hours!",4.0,Respected|Inspirational|Group projects
Geoffrey Challen,"Genuinely cares about teaching and his students. Sometimes he went too fast and this was very frustrating for beginners. However, he responds and changes according to anonymous feedback forms, which I really appreciated. There is daily homework and mandatory attendance, but also a generous drop policy.",4.0,LOTS OF HOMEWORK|Clear grading criteria|Caring
Geoffrey Challen,"His lectures were absolutely amazing, I know my stuff but I still learned a whole lot! His lectures are mandatory and you do have to keep up with the slides to get credit, but you also get 10 drop lecture attendances! His class isn't the easiest but he does his fair share to make an A worth what it is. If you work hard, A isn't an issue.",5.0,Skip class? You won't pass.|Amazing lectures|EXTRA CREDIT
Geoffrey Challen,"Geoff's CS125 class is fantastic. He has improved it constantly through feedback, and it will only get better. The class is hard, and will be a huge challenge for beginners. However, towards the end of the course, you will know all the work was worth it. He really cares about every student and really made the 9 AM lectures bearable.",5.0,Skip class? You won't pass.|Amazing lectures|Caring
Geoffrey Challen,"Really good prof, seriously.",5.0,Amazing lectures|EXTRA CREDIT|GROUP PROJECTS
Geoffrey Challen,"Very good class. Everything is structured extremely well, and it's clear that Geoff has/is putting in a LOT of work towards improving the class. His lectures were very comprehensive, and whenever I didn't understand something, I could just look back into the lecture video. He cares a lot about his students, and the grading is very generous.",5.0,Skip class? You won't pass.
Geoffrey Challen,"I had no coding experience coming to this class. Not gonna lie. This class was tough. Spent more than 10 -12 hours a week alone on Machine Problems. However, Geoff take feedback pretty well and will hear his students out. Going to office hours consistently will help you do well on this class. Class doesn't get easier, but its gets better.",5.0,Skip class? You won't pass.|ACCESSIBLE OUTSIDE CLASS|Caring
Geoffrey Challen,"Don't get me wrong, CS125 is hard even to the ones who have taken ap in high school. But I honestly think geoff tries to guide us to understand the concepts. Also his grading system is really generous. I absolutely bombed my first midterm(68) and still end up getting A( 96) overall, he also gives lots of extra credits",4.0,Participation matters|LOTS OF HOMEWORK|EXTRA CREDIT
Geoffrey Challen,"There is no doubt that this is a hard course. Actually, it is the hardest course I have ever taken, even much harder than 400-level math courses. However, I do think Challen is a good professor. He is passionate about teaching, and always willing to give students help. The MPs are hard, but it turns out that we can learn a lot from this course!",5.0,Clear grading criteria|EXTRA CREDIT|GROUP PROJECTS
Geoffrey Challen,Super hard midterm. Hmmm. Proving Fermat's Last Theorem is much easier than his midterm.,1.0,LOTS OF HOMEWORK|TEST HEAVY|EXTRA CREDIT
Geoffrey Challen,Geoff is awesome. He really cares about his students and is extremely helpful. I wasn't sure if I wanted to do CS but now I know I do. A word of caution: this class is hard and moves quickly. It's easy to get an A if you stay on top of it though.,5.0,Gives good feedback|Respected|ACCESSIBLE OUTSIDE CLASS
Geoffrey Challen,"Geoff clearly really cares about his students. You can really tell that he has put in a lot of effort to make this class accessible to as many people as possible. Don't get me wrong, this is not an easy class, but there are many resources available to help you do well.",5.0,ACCESSIBLE OUTSIDE CLASS|Clear grading criteria|Caring
Geoffrey Challen,"He is patient and very good at explaining topics . There is a lot of work, but if you do it and study for quizzes/midterms, then you will get an A. He is very active at answering questions on the forum. The CAs/TAs are very helpful. There were few bugs in the assignments. The class was very well-organized.",5.0,LOTS OF HOMEWORK|Caring|EXTRA CREDIT
Geoffrey Challen,"CS 125 is more time-consuming than other intro courses, but Geoff has put a lot of effort into making it accessible to anyone (I personally had a little Python and no Java experience before taking CS 125). Daily quizzes, weekly homework, and biweekly machine problems (MPs) prevents slacking, but it's ultimately rewarding.",5.0,Participation matters|LOTS OF HOMEWORK|ACCESSIBLE OUTSIDE CLASS
Geoffrey Challen,"This is one of the most amazing courses I've ever taken. It's REALLY hard for a starter to surive this course, but after coming along a long, long adventure, you find yourself harvest a great deal. The grading for this course is also generous, as about 50% people can get A. Take this if you love CS, or leave the seat for those who loves it.",5.0,Skip class? You won't pass.|TEST HEAVY|EXTRA CREDIT
Geoffrey Challen,"For fall 2018 CS125, Indeed it's a little bit too hard even for people who have learned AP CS before, but it's worthwhile to work your ass off and learn a hell out. ECs were given. Geoff earns my respect at least. Really fantastic lecturer. :D",4.0,Inspirational|Amazing lectures|EXTRA CREDIT
Geoffrey Challen,"I don't really understand the Geoff hate on here. The class is tough, no doubt about it. But coming from someone with very little previous experience, his class is doable. He's also super active on the forum and on reddit which can be really helpful.",5.0,Skip class? You won't pass.|LOTS OF HOMEWORK|ACCESSIBLE OUTSIDE CLASS
Geoffrey Challen,awfull,1.0,Skip class? You won't pass.|TEST HEAVY|LOTS OF HOMEWORK
Geoffrey Challen,"I have never seen someone put so much effort in to teaching his students. Geoff really does care about teaching us and the amount of work he puts into it is reflective of that. Having a learned a little java prior to entering this class I thought I would be in for an easy A. Instead, I ended up learning SO MUCH. You will work for an A, but worth it",5.0,Skip class? You won't pass.|LOTS OF HOMEWORK|Clear grading criteria
Geoffrey Challen,"If you go to class, follow the slides (to get participation points), do the daily hws, work on the MP early and get 100 for all MPs, then you will do well on quizes and midterms. Since the grading components are really nice, if you work hard, you will get an A. ps: MP are worth a lot, make sure to do them and get 100 on them.",5.0,Gives good feedback|Clear grading criteria|Amazing lectures
Geoffrey Challen,"Explained things clearly and covered a lot of useful material. Only now that I'm at a different university do I realize how well taught CS 125 was. Some people love to hate on him because of the course difficulty, but it's worth it and you can definitely do it as long as you don't procrastinate.",5.0,Respected|Skip class? You won't pass.
Geoffrey Challen,"Geoff gets a lot of slack in this class but he actually works incredibly hard to make this a better CS class/school. Before this year 125 was a very easy class, especially for those with experience. Now, however, it is difficult, and extremely difficult if you don't have experience. Be prepared to sell your soul, but you will learn a HELL OF A LOT.",4.0,Tough Grader|Skip class? You won't pass.|LOTS OF HOMEWORK
Geoffrey Challen,"Class is extremely difficult and not beginner level at all. MP's are almost never related to lecture and you have to use code he never taught you yet in order to complete them. If you have 4 years of programming experience or a really smart friend, this will be fine. But for everyone else, office hours everyday. Get out of this class if possible.",1.0,Tough Grader|Skip class? You won't pass.|LOTS OF HOMEWORK
Geoffrey Challen,"I enjoyed his lecturing A LOT. I think he is pretty talented as a lecturer. He expresses things pretty clearly. EVERYTHING MAKES SENSE in this class. In Spring 2018, we had more than 100 CA to answer our questions and help with MPs But don't need to worry about grades that much, most people got A at last. There are several extra credit opportunitie",5.0,Inspirational|Clear grading criteria|Amazing lectures
Geoffrey Challen,Extremely arrogant.,1.0,BEWARE OF POP QUIZZES
Geoffrey Challen,Awful experience overall.,1.0,Tough Grader|LOTS OF HOMEWORK|BEWARE OF POP QUIZZES
Geoffrey Challen,"Challen is very passionate about teaching and he tries to make sure that help is always accessible. The grading is quite generous as 12% of students in Spring 2018 got 100% or higher in the class. However, the MPs are challenging and I would not recommend taking this class unless you are prepared to invest hours of work every week into the MPs.",5.0,Respected|Caring|EXTRA CREDIT
Geoffrey Challen,"While the course has a bit of a learning curve at the start, it is COMPLETELY worth it to get over the hump. Professor Challen runs his class well, and I learnt a lot in the course (much more than if I had taken CS 101). I went from having no knowledge of CS, to making a working android app. Highly recommend CS125 with Geoff - makes class great!",5.0,Participation matters|Clear grading criteria|EXTRA CREDIT
Geoffrey Challen,"CS 125 was a challenging by rewarding class. I don't think the current rating of him (2.2) fits what I saw in my class (Spring 2018). Notes, quizzes, and MPs were all relevant. Everything was solvable, but not necessarily easy. You will learn a lot and have it be relevant knowledge in his classes. Put in the work and you will be fine.",4.0,Participation matters|LOTS OF HOMEWORK|Inspirational
Geoffrey Challen,I got mental illness after taking his class. His class is funny but the homework tortures me a lot. I am a freshman and I hope my rest of the college life can be better.,5.0,Hilarious|TEST HEAVY|Amazing lectures
