professor,comment,rating,tags
Gretchen Adams,"Gretchen is the best Chem teacher ever created. I hated Chem in HS, but when she taught me i actually started to love it! I hate myself for loving but goddamn its my guilty pleasure. It is like math, and with math takes practice. Take the homework assignments seriously, and do learn from it. This class should have stood for 4 credit hours :(",5.0,Skip class? You won't pass.|TEST HEAVY|Amazing lectures
Gretchen Adams,"Gretchen is an AMAZING professor. If you take chem 101 do not take one of the TAs that teaches one section of her class, I has to transfer out of his class and it is why I can't get an A in that class. With her an easy A is possible.",5.0,Get ready to read|Participation matters|ACCESSIBLE OUTSIDE CLASS
Gretchen Adams,She is really nice and gives great lectures as well as one-on-one time.,5.0,Hilarious|Amazing lectures|Caring
Gretchen Adams,Her lectures definitely aren't boring. It's very obvious that she loves what she does and that makes this class a lot better.,5.0,Gives good feedback|Respected|Amazing lectures
Scott Ahlgren,"Prof. Ahlgren was so, so nice and patient. One time, I submitted the wrong homework assignment, and he let me turn it in 3 days later for full credit! He's very compassionate and kind. Amazing professor.",5.0,Gives good feedback|Respected|Accessible outside class
Scott Ahlgren,Gem of a teacher. Lectures are extremely helpful and develop both theory and problem-solving techniques. He's always ready to help his students and goes the extra mile. Would highly recommend!,5.0,Gives good feedback|Clear grading criteria|Amazing lectures
Scott Ahlgren,"Prof. Ahlgren really cares about teaching. His lectures contain his own understanding to the topic. Exams are not hard. He gives a lot of office hours, around three or four hours per week, and he is quite friendly during office hours.",5.0,Respected|Accessible outside class|Amazing lectures
Scott Ahlgren,"Ahlgren is an awesome professor. He actually made calc 2 a great way to start the day. Lectures were some derivations and tons of examples, which is exactly what you need for the class. Not to mention, he's got a great sense of humor and is pretty down-to-earth, though he is really quirky, even bordering on awkward. Good guy, great teacher.",5.0,Amazing lectures|Hilarious|Clear grading criteria
Scott Ahlgren,Do the extra practice problems in the book  A's on the midterms,5.0,Respected|Inspirational|Hilarious
Scott Ahlgren,"Great professor even though the course can be tough for a lot of people. It's really important to study in this class, this is a subject that can trip people up, and a lot of difficult problems can show up on exams and get you. Funny guy too",5.0,Respected|Skip class? You won't pass.|Hilarious
Scott Ahlgren,"He's a really really great professor! In the beginning, it was hard to keep up with what he was doing but as time went  on, I eventually got used to the fast pace of the course. Make sure you do the homework and use the office hours. And make sure you STUDY! Can't emphasize how many points I got off for silly mistakes on the exams.",5.0,Tough Grader|Skip class? You won't pass.|LOTS OF HOMEWORK
Scott Ahlgren,He is a good lecturer. He is a really fair grader and explains every topic fairly clearly. I would recommend him if you are planning to take calc 2. He is also hilarious. Would recommend him for sure.,4.0,Hilarious|Amazing lectures
Scott Ahlgren,Professor Ahlgren is amazing!  He is really funny and makes math lecture an extremely pleasant place to be.  He is definitely the best choice for a Calc 2 professor.  I strongly recommend him.  He gives lots of good examples and explains everything very clearly!,5.0,Inspirational|Hilarious|Amazing lectures
Iftikhar Ahmed,"Online lectures were terrible. Heavy accent, mediocre handwriting, and long undirected videos made listening to his lectures a waste of time. The only good thing is the grading of the course, which has exams fairly often and drops the worst one, with past exams posted to study from. Watch other professor's lectures to learn, like Professor Leonard.",2.0,Clear grading criteria
Iftikhar Ahmed,Horrible. Lecture videos are clips from multiple semesters of recording with little or no conjunction. Lecture notes are taken from the previous professor. Impossible to understand. Literarily get dizzy watching his videos as he like to scroll the page a lot. No practice exams available. Ready to learn everything yourself and pray for a good TA.,1.0,Lots of homework|Lecture heavy|Tough grader
Iftikhar Ahmed,"Hour long videos where his handwriting is unreadable, his accent is so thick, and some of his work is cropped out so you don't understand what he's saying. The assignments don't help you learn at all. Overall horrible class.",1.0,Graded by few things|Test heavy|Lecture heavy
Iftikhar Ahmed,The lectures were not clear at all and the homework was too hard a lot of the time. I do not even feel like I learned a lot in this class and was very discouraged by how poorly it was taught.,1.0,Test heavy
Iftikhar Ahmed,"Horrible class. I spent way too much time just trying to find material than learning anything. Having done extremely well before in math courses, I would say this was the worst teaching I have ever had.",1.0,Lots of homework|Graded by few things|Lecture heavy
Iftikhar Ahmed,He does not know how to give lectures nor does he know how to give help to kids. I did not like him at all and I would recommend never taking this class with this professor.,1.0,Lots of homework|Test heavy|Lecture heavy
Iftikhar Ahmed,"I honestly felt completely and utterly failed by the UIUC math department while taking this class. This class is a robbery. Lectures are unwatchable, so bad that more than 50% of students just refuse to go and instead learn from free videos on Youtube. Homework has nothing to do with lectures or test, and is due on test days. Avoid at all costs.",1.0,Graded by few things|Test heavy|Tough grader
Iftikhar Ahmed,"I swear by the Seven kingdoms that this will probably be your worst math class you will ever take in the history of humanity. And I mean it! For 13 years I aced all my math classes homework and assignments! Calc 1 and 2 were a piece of cake compared to this disaster! DO NOT TAKE THIS CLASS WITH HIM!!! Its a waste of time, money, and mental capacit",1.0,Graded by few things|Test heavy|Tough grader
Iftikhar Ahmed,"Not good at ""teaching"", I've barely survived, my saving grace was youtube professors.",1.0,Graded by few things|Test heavy|Tough grader
Iftikhar Ahmed,Worst Math class I have ever taken in my life. I never hated math like this in my life. Do not take this class with him. Please! For you own sake and mental health.,1.0,Lots of homework|Skip class? You won't pass.|Graded by few things
Iftikhar Ahmed,"TAs in office hours and discussion carried the whole class, lectures were poor quality, hard to watch with really bad background noise and microphone quality. Previous math professors have been decent to very good, even with the sudden transition to online learning but He does not seem to have made a graceful transition, after several semesters.",1.0,Graded by few things|Test heavy|Lecture heavy
Iftikhar Ahmed,An absolutely terrible professor and a disgrace to the quality of education at UIUC. You're better off taking the proficiency exam or teaching yourself the material than sitting through the trainwrecks that are his lectures.,1.0,Graded by few things|Test heavy
Iftikhar Ahmed,The definition of depression,1.0,Graded by few things|Test heavy
Iftikhar Ahmed,"I am speechless at this point, but I really do not wish for my enemies to be in my position right now! DO NOT TAKE THIS CLASS WITH HIM!!!!!!!",1.0,Lots of homework|Graded by few things|Tough grader
Iftikhar Ahmed,"The only thing you'll learn from his classes are how to maximize the number of times you say ""uh"" per sentence when you speak. Unbelievably, hilariously terrible and long winded explanations of otherwise simple enough topics. If I had a penny for every time I was confused by his lectures, I could finally pay my student debt.",1.0,Lots of homework
Iftikhar Ahmed,"Believe me for your sake and for your health, do not take a class with him. Study, and take the proficiency test! You will regret every moment in this class. If you want to understand the material, need to do it on your own. Lectures can just make you hate math as much as possible. I might lose my scholarship because of this class!",1.0,Lots of homework|Skip class? You won't pass.|Graded by few things
Iftikhar Ahmed,"Horrible professor. He posts two 50 minute lectures for every topic that cover about half the stuff that shows up on the homeworks. Makes you participate on the forum for credit so there's about 10 redundant, unhelpful answers to each question someone . Never responds to questions or feedback, EVER. You're better off learning on YouTube or at CC.",1.0,Test heavy
Iftikhar Ahmed,Some of the worst online teaching I've ever seen. The lectures seem like they were recorded in a lunchbreak. You better hope your TA is a good teacher because you will struggle to be taught anything.,2.0,Graded by few things
Iftikhar Ahmed,He is an absolute disaster. His lectures are not only meaningless and makes it harder to grasp the material but also he reuses it from the previous semester. Doesn't show any sign of quality or whatsoever. He is a disgrace to the rest of the mathematics faculty and to the quality of education at UIUC. Professor Leonard is the only option you have.,1.0,Graded by few things|Test heavy
Iftikhar Ahmed,Assigns webassigns that will be covered in the midterm the day before midterm. Lectures aren't helpful at all learned everything in the course so far from youtube. Doesn't even post practice materials on Prairielearn after the first test so you have to jump around a bunch of loosely grouped materials to find anything useful.,1.0,Lots of homework
Iftikhar Ahmed,This professor is not good what so ever... he used the same lecture videos as the semester before meaning he doesn't care to revise his work. The practice for quizzes and exams don't help much. You'll be learning from YouTube and the textbook for this class. He's a disgrace to your learning at UIUC as well as the field of teaching!,1.0,Graded by few things|Test heavy|Tough grader
Iftikhar Ahmed,Good prof. Bit of an accent,4.0,Lots of homework|Get ready to read|Test heavy
Iftikhar Ahmed,"Prof was very confusing in lecture videos, and sometimes we couldn't even see everything he was writing bc it would be cut off from the screen. His explanations weren't clear and I was confused the entire semester. There was a lot of hw, 5 midterms, 5 quizzes. Took a toll on my mental health this semester. :(",1.0,Lots of homework
Iftikhar Ahmed,"His lectures are not helpful, you will be learning the material by yourself for the most part. He explains subjects in a way that makes them so complicated, you are better off asking TAs about the subjects or watching videos online to learn the material.",1.0,Skip class? You won't pass.|Test heavy
Iftikhar Ahmed,His lectures leave much to be desired. Watch Leonard on YouTube instead. His strong point as a teacher is his ability to run helpful and efficient office hours; he seems to know what you're asking before you even ask it. Homework is sometimes detached from what appears on exams so do them with answers available. His exams are fair and doable.,2.0,Lots of homework|Get ready to read|Test heavy
Iftikhar Ahmed,"Dude has no idea how to teach, the homework has nothing to do with the tests or quizzes.",1.0,Skip class? You won't pass.|Test heavy
Iftikhar Ahmed,"Feel like the lectures are barely comprehensible and helpful, and the questions from the homework and worksheets are as slippery as worms since the examples he gives in the lectures are very basic. Terrible experience with this guy and this class compared to calc 1 and 2 which I both got A+ in.",1.0,Lots of homework|Graded by few things|Test heavy
Iftikhar Ahmed,"I took this class during covid. The lecture is 100% useless. Cannot understand anything he was saying. He never explained well on any topics. I gave up watching the lecture after a couple of weeks. Completely self-taught by reading the textbook. 86% of the grade is based on exams, which is annoying. Honestly, how did this guy become a professor????",1.0,Test heavy
Iftikhar Ahmed,The lectures were 2x longer than they had to be and meandered all over the place. He would often scroll up 2-3 pages in the notes to change a variable name then return to the bottom and begin a whole new topic. There were plenty of huge gaps in his sentences and incomplete thoughts. I had to teach myself lots of the material.,2.0,Get ready to read|Graded by few things|Lecture heavy
Iftikhar Ahmed,"Barely comprehensible, talks slowly with long pauses.",1.0,Lots of homework|Graded by few things|Lecture heavy
Iftikhar Ahmed,"Cant understand his accent and he fails to explain literally anything in the lectures. I want a teacher, not a recitation of the wiki page.",1.0,Test heavy|Lots of homework
Iftikhar Ahmed,"Prof. Ifti will work with you and try his best to explain the concepts to us. He will ask test questions that are directly based on lecture, so it's recommended that you go. The tests aren't that hard, but studying for it will help you a lot in the long run (for the final exam).",4.0,Accessible outside class|Clear grading criteria|Lecture heavy
Iftikhar Ahmed,He is hard to understand and overcomplicates simple things. It is truly amazing that I passed this class. I finished with a 44% and luckily everyone else did so bad that my final grade got curved to a 61% and barely passed. Steer clear of this class and TAKE AT COMMUNITY COLLEGE IF POSSIBLE,1.0,Skip class? You won't pass.|Test heavy|Tough grader
Iftikhar Ahmed,A great professor overall. Tests compose a huge portion of the course grade but the midterms were pretty straight forward. The final exam was a bit difficult but the class was curved.,4.0,Accessible outside class|Test heavy
Iftikhar Ahmed,His lectures dont relate to what is going to be on the homework or quizzes. The material is easy but he spends an hour explaining something my TA would sufficiently spend 5 minutes going over while relating it to our work. You cant study from the book or past work for the exams because theyre completely off topic.,1.0,Graded by few things|Test heavy|Tough grader
Iftikhar Ahmed,The worst class at the university. I used to love math and wanted to major in math before taking this exam. No longer do I want to major in math. The worst professor. Doesn't teach at all and the lectures are useless. I went to every lecture and TA discussion section. Still have a terrible grade in the class. Exam averages were awful.,1.0,Graded by few things|Test heavy|Tough grader
Iftikhar Ahmed,Im an A student. This class dropped my GPA from 3.75 to 3.2 singlehandedly. Practice exams and tutoring doesnt help. Homework doesnt match what is being taught. Exams are majority of the full grade and there are no curves. Exam problems are more challenging than they need to be. Please save yourself and avoid if possible.,1.0,Get ready to read|Test heavy|Tough grader
Iftikhar Ahmed,"Homework has nothing to do with the test, practice exams are useless since theyre nothing like the actual test, and the exams have to curve.",1.0,Lots of homework|Lecture heavy|Tough grader
Iftikhar Ahmed,"I studied over 20 hours for the third midterm and got under a 20%, the average was a failing grade and he still won't curve it. No idea how this happens, tough class but it shouldn't be THIS tough. He needs to teach more, the lectures are useless.",1.0,Lots of homework|Test heavy|Clear grading criteria
Iftikhar Ahmed,"I am currently enrolled in this class, and I highly highly recommend to not take this course. The course is mainly graded off of the midterms and final which take up 75% of the weight. To keep that in perspective, the avgerae grade for our third midterm was 52%. How do you succeed in a class when the average is a 52% on a test worth 15% of theclass",1.0,Skip class? You won't pass.|Test heavy|Tough grader
Iftikhar Ahmed,"This is a self taught class. If you NEED to take this class, the best advice is to take it at community college where you will learn it the right way. You will not succeed in this class here.",1.0,Get ready to read|Graded by few things|Test heavy
Iftikhar Ahmed,"Lecture attendance wasn't required, but it was useless anyway because it is impossible to learn anything with this professor. Exams were brutal, and the final and 3 midterms equal 75% of the course grade. Homework was useless, and the 3rd midterm had a failing average, that says a lot. Avoid this professor at all costs.",1.0,Lots of homework|Test heavy
Iftikhar Ahmed,"it is a very hard class to pass because it is a very hard class to learn it. You will learn nothing at the lectures, or the ta sessions because you don't comprehend the material in lecture to talk about in the TA sessions. The last midterm average was a 54% which is horrible, and he refused to grade it. Lecture attendance is down to 50 from 300.",1.0,Lots of homework|Test heavy|Tough grader
Iftikhar Ahmed,"Is horrible at explaining during lecture. basically pointless to go because you will end up spending hours doing the homework and re-teaching yourself anyways. midterm practices are a joke, midterm 3 average score was a 55% if that says anything. Discussions are nice but the TA I had didnt do anything but pass out homework and answer questions",1.0,Lots of homework|Test heavy|Tough grader
Iftikhar Ahmed,"While the class overall seems to be manageable, if you do bad on the exams there is no hope for getting a good grade in that class. There are absolutely no curves, and it is really annoying. Exam 3 was unnecessarily difficult,and we were not given enough time to answer all of the questions. The class average ended up being a 52%. BUT STILL NO CURVE",2.0,Test heavy|Tough grader
Iftikhar Ahmed,"Ifti is a professor who unnecessarily does more work than necessary to finish the math problems. He has some issues controlling the class and the lecture and discussions do not match up. I am so sorry if you have to take MATH 234, however it is an easy class. He is also confusing to understand.",1.0,LOTS OF HOMEWORK|GRADED BY FEW THINGS|LECTURE HEAVY
Iftikhar Ahmed,"We had a small scale class- about 20 students, so he really got to know us personally. When other 231 TAs graded by accuracy on discussion questions, he just graded by effort and attendence. He is good at explaining things in lectures at least for me. To sum up, kind. I would recommend you take his class.",5.0,Gives good feedback|Respected|ACCESSIBLE OUTSIDE CLASS
Abdussalam Alawini,"Willing to discuss class structure outside of class, accessible. Group project - start early (not hard, but very stressful if delayed)! Class is easy. Textbook is rarely required. Homework wasn't too long / difficult. Covers 3 different types of databases types. Strongly recommend any CS student to take as the material of the class is important.",5.0,Accessible outside class|Group projects|Caring
Abdussalam Alawini,"Quite honestly the most effective course I've taken at the U of I, thanks to Prof. Abdu. Not only is he hilarious, but his lectures are extremely clear and he's very approachable before and after class. The lectures are faster-paced, so you may benefit from reading the textbook beforehand. Not mandatory, though. AND he memorized our names! WHAAT",5.0,Accessible outside class|Clear grading criteria|Caring
Abdussalam Alawini,He is very responsible and kind. Always willing to help. The lectures are interesting and helpful and I truly recommend this class!,5.0,Gives good feedback|Respected|Group projects
Abdussalam Alawini,Excellent prof!!!,5.0,Gives good feedback
Abdussalam Alawini,"Professor Abdu very well knowledgeable in his field and is also very approachable. He takes immense feedback from his students and changes the course to make sure that all of the concerns people have are taken care of. Take his class if you decently challenging class with a great professor, take his class.",5.0,Respected|Amazing lectures|Caring
Abdussalam Alawini,"I have both been a student and a TA for this class. When I took this course as a student, I felt the course was challenging. When I worked as a TA for this course, I got to know how much effort the instructors have put into this course(Yes, we put A LOT OF time into this course). Abdu is a passionate, hard-working, and caring professor.",5.0,Gives good feedback|Lots of homework
Abdussalam Alawini,Gives off good vibes. Very nice guy too and he teaches the class pretty well.,5.0,Accessible outside class|Hilarious|Caring
Abdussalam Alawini,"Amazing professor. One of the first professors that I've had that actually attempts to connect with his class in ways that aren't just related to the material. I would highly recommend anyone take a class with him if they have the chance! Abdu has clear lesson plans, clear grading criteria, and makes sure to adjust deadlines if needed",5.0,Respected|Clear grading criteria|Lecture heavy
Abdussalam Alawini,"Abdu is nothing but helpful. I would give nothing but respect for this man. His teaching style reminds me every day of what it means to be an engineer. His work ethic, his character, his respect for truly teaching students-all of it creates an atmosphere of constant inspiration. Especially with the times of this semester, Abdu carried me threw it.",5.0,Gives good feedback|Accessible outside class|Caring
Abdussalam Alawini,"Honestly Abdu is the ultimate homie. He is funny, smart, and actually wants his students to succeed. HW is fair and greatly prepares you for the exams. Also the final project really can be awesome if you want it to be. I've seen few other professors take feedback as seriously as Abdu. He wants his class to be top tier, and frankly, it is.",5.0,Clear grading criteria|Hilarious|Caring
Abdussalam Alawini,"To put it shortly, Abdu is an amazing professor who makes the learning environment feel fresh with his character. He gives a lot of opportunities to help you understand the material better and provides extra credit to help students out. Homework may seem heavy but is easily doable with the appropriate time and effort.",5.0,Inspirational|Clear grading criteria|EXTRA CREDIT
Abdussalam Alawini,"Best course taken so far as CS Graduate student at UIUC. If I happen to become a professor, I'd like to be as empathetic and approachable as he is. He LISTENS to students, and is always happy to help! He is the best professor. Period.",5.0,Inspirational|Amazing lectures|Caring
Abdussalam Alawini,"A professor who really cares students, making you feel so worthy devoting your time to the class, having jokes and activities in class which help you focus, one of the best teachers I've ever had.",5.0,Group projects|Amazing lectures|Caring
Abdussalam Alawini,"Feel the Prof really cares about students and helpful. The exam was okay, similar to the examples and homework. But the group project is heavy.",5.0,Accessible outside class|Group projects|Hilarious
Abdussalam Alawini,"Well Organized class. Great Professor, very clear. The only complaint is that this class further facilitates the scam that is the IClicker. Shame on you UIUC",5.0,Respected|Lots of homework|Participation matters
Abdussalam Alawini,Fantastic professor. Honestly one of my favorite teachers I've had during college. Really listens to feedback and seems to care about his students and the class,5.0,Group projects|Hilarious|Amazing lectures
Abdussalam Alawini,"Honestly as a person who wishes to teach one day, Abdu is a role model for me. He is the perfect example of how a professor truly cares about his students. The course so far is great! It covers almost all the essentials you need to learn about database systems.",5.0,Lots of homework|Caring|EXTRA CREDIT
Abdussalam Alawini,Great professor who genuinely cares about student feedback and is very approachable outside of class.,5.0,Gives good feedback|Respected|Accessible outside class
Abdussalam Alawini,Cares about feedback from students and a great and compassionate professor. Definitely very approachable.,5.0,Gives good feedback|Accessible outside class|Group projects
Abdussalam Alawini,"Abdu is so cute and passionate. Jokes aside, definitely approachable after class if you need help, he listens to feedback and really wants his students to get their money's worth.",5.0,Inspirational|Group projects|Caring
Abdussalam Alawini,"Abdu is a great professor. You can tell that he cares a lot about the subject and his students. It's a huge class and he does his best to make everyone feel welcome. Some other students seem to dislike his humor and the way he makes class interactive, but honestly I think its refreshing to have a CS professor who cares as much as he does.",5.0,Group projects|Hilarious|Caring
Abdussalam Alawini,"This is the first course i've taken in CS department, this is a very good fundamental course even though it's in 4 level. He cares about students, tried very hard to answer every single question, even made a video after class when he finds out most of us cannot figure out some concepts in class. Highly recommend! Best professor I've ever met.",5.0,Respected|Inspirational|Hilarious
Abdussalam Alawini,"Best professor in UIUC. He answers more than 70% questions on piazza, and he really takes efforts. Homework is not easy, but not taking much time. Project has few restrictions, good chance to open your mind. Review sessions (most from TA) are also helpful, which save your time on homework and exam. Class is interesting and clear. Again, best prof.",5.0,Gives good feedback|Respected|ACCESSIBLE OUTSIDE CLASS
