professor,comment,rating,tags
Lawrence DeBrock,One of the courses that I do not like the most!!! The knowledge in class is not practical. Grade is not as easy as people say so. The instructor is grading harsh.,2.0,LOTS OF HOMEWORK|EXTRA CREDIT|GROUP PROJECTS
Don Decoste,This man is so amazing.... I don't think I'll ever have a professor this great for the rest of my college career. He clearly cares about helping his students out and gives credit where credit is due. His demonstrations are super fun and also really educational. Awesome guy all around.,5.0,Hilarious|Amazing lectures|Caring
Don Decoste,"I had Dr. DeCoste for CHEM 202/204 this year, and he is the most inspirational teacher I've had. Without AP Chem, I started out behind but caught up. Go to his office hours! He genuinely cares and wants to help. He's an amazing person, and teaches problem solving rather than memorization. I've never learned as much in a year as I did in his class.",5.0,Accessible outside class|Inspirational|Amazing lectures
Don Decoste,"He is just beyond description, no words for complement in my mind could come up cuz they are not that enough to depict how amazing he is",5.0,Accessible outside class|Inspirational|Amazing lectures
Don Decoste,"9000/10 the absolute best professor that I've ever had in my life. Ever. I had him for CHEM 202 and CHEM 204. Although it may seem like you shouldn't have taken the class if/when you don't get great grades, DeCoste challenges you to think in ways no other class you ever take will which will benefit you more than you think later on in life.",5.0,Accessible outside class|Inspirational|Amazing lectures
Don Decoste,"Don Decoste is an absolute legend. If I could give more than five stars, I would. Thats not to say this is an easy class. Its very hard, but thats because he believes in the value of teaching skills like problem solving instead of memorizing random facts. Lectures are always engaging, informative, and very entertaining. 10/10 would take again!",5.0,Respected|Inspirational|Amazing lectures
Don Decoste,Go to his office hours so he knows your name. He really wants to help people. Don't worry about looking stupid or anything. His class is hard and the grades reflect that but the final is a lot easier than all of the unit tests so take that into account before dropping,4.0,Tough Grader|Respected|ACCESSIBLE OUTSIDE CLASS
Don Decoste,"Dr. DeCoste explains everything so well and clearly. There is a great amount of work for this class, but if you know to how study smart and hard, you can succeed. Lectures aren't mandatory, but they're totally worth going to. Don't just read the textbook and watch the videos as if you have to, make sure you understand the material thoroughly.",5.0,Respected|ACCESSIBLE OUTSIDE CLASS|Amazing lectures
Don Decoste,"He's a very good lecturer. The tests are kind of hard but he curves the hell out of them, so it's fine",5.0,Inspirational|Amazing lectures
Don Decoste,Amazing lectures!! He really knows what he's talking about. He's funny at times and really makes sure we're understanding the material.,5.0,LOTS OF HOMEWORK|ACCESSIBLE OUTSIDE CLASS|Amazing lectures
Don Decoste,I love him.,5.0,Gives good feedback|Respected|Inspirational
Don Decoste,"Go to office hours, do all the homework provided and the practice tests. The grade is based primarily on exams, which test your ability to solve a lot of difficult problems relatively quickly. Knowing Decoste's methods help, and he works through problems during office hours. Take notes during lecture as he goes over problems he expects you to know.",4.0,Skip class? You won't pass.|ACCESSIBLE OUTSIDE CLASS|Tests are tough
Don Decoste,"Dr. DeCoste is fine. Everyone makes him out to be some sort of chemistry education guru, but he is mediocre in my opinion. He's much much better than many other professors, but that is because of how bad all the other chemistry professors are not because of how good he is.",2.0,Tough Grader|Respected|TEST HEAVY
Don Decoste,Dr. DeCoste is a great professor and he gives clear lectures. Tests are not so hard and he curves a lot so the average should be around 85 or so. He is patient on answering students' questions during office hours and he really makes his student learn a lot from his instruction.,5.0,ACCESSIBLE OUTSIDE CLASS|Amazing lectures|Would take again
Don Decoste,"Great explanations in class. Lots of material to go through, but he still takes the time to answer student questions and do demos at the end of most lectures. He has a dad's sense of humor (go figure) and genuinely cares about his students as if they were his own kids. Great professor to have, real pleasure to be in his class. Watch the videos!",5.0,Respected|Skip class? You won't pass.|Caring
Don Decoste,"Prof. DeCoste is amazing, he clearly knows what hes doing and always willing to help. GO TO OFFICE HOURS!! Do not fall behind in this class. If you do, say goodbye to your GPA. This class is accelerated for a reason and it helps to know your stuff before hand. He is funny and understanding. Go to lecture, if anything, he blows stuff up.",5.0,Gives good feedback|Skip class? You won't pass.|LOTS OF HOMEWORK
Don Decoste,A fantastic professor. Good at speaking. So great.,5.0,Tough Grader|Respected|Hilarious
Don Decoste,"Lots of amazing experiments in lectures, but the lectures are not so organized. Office hours are super helpful. Tests are easy if you did all the homework and understood how to apply the concepts.",5.0,Tough Grader|LOTS OF HOMEWORK|ACCESSIBLE OUTSIDE CLASS
Don Decoste,"DeCoste prepares his students for challenging material and critical thinking; he deserves his role as an education specialist. He is a perfect example of firm yet fair; his tests are challenging and make you relate concepts in nearly every way possible. At the same time, he is very caring and approachable. He's an outstanding undergrad instructor.",5.0,Respected|ACCESSIBLE OUTSIDE CLASS|Caring
Don Decoste,"Decoste is a great professor and super helpful in office hours. Pay attention in class and learn to use his methods, because that's the only way you'll survive his tests. He can speak quickly sometimes, but don't be afraid to ask questions because he's really nice.",5.0,Amazing lectures|LECTURE HEAVY|ACCESSIBLE OUTSIDE CLASS
Don Decoste,One of the best professors in the department. Read the textbook and study the challenge problems he assigns because those are similar to the level of difficulty as his test. Online quizzes are hard so work together with friends on them.,4.0,Respected|ACCESSIBLE OUTSIDE CLASS|Amazing lectures
Don Decoste,Amazing professor that specializes in educational research!,5.0,ACCESSIBLE OUTSIDE CLASS|TEST HEAVY|Amazing lectures
Don Decoste,"Decoste is a really great professor! He does fun experiments & cares for his students, so if you're struggling, talk to him. However, I wouldn't recommend taking this unless you have a solid chem background.  I had taken chem my sophomore year of hs and it's not enough for you to pass this class. If you're a ChemE, try the other sequence of classes",4.0,Tough Grader|Respected|Caring
Don Decoste,Fun teacher but very hard  course without AP Chem.,4.0,Tough Grader|LOTS OF HOMEWORK|Hilarious
Don Decoste,"Dr. Decoste is a great guy that's willing to help whenever you need it! In the beginning, don't take that for granted! His tests are very conceptual consisting of FRQs and multiple choice. THIS IS NOT A MEMORIZING CLASS! be prepared to read, seek help, and go to office hours. Decoste is a great lecturer and answers all questions in class.",4.0,Tough Grader|Respected|TEST HEAVY
Don Decoste,"This man is one of the greatest professors I have come across in my time at UIUC. It is evident that he cares enormously about his students, and wants the best for them. However, his class is tough as hell. You will not succeed if you are not willing to work for it. Being Decoste's student was worth every tear shed during the semester.",5.0,Respected|LOTS OF HOMEWORK|Caring
Don Decoste,"Dr. DeCoste tries to keep the class interested by his practical examples. He literally blows the class up. He is really interested with the class and he loves his students. GO TO HIS OFFICE HOURS. It is like a free private lesson if you're lucky. Plan to go early because it tends to be full. Nonetheless, his exams are not easy, but still doable.",5.0,ACCESSIBLE OUTSIDE CLASS|Amazing lectures|Caring
Don Decoste,"He cares more about blowing up oxygen filled coke bottles and scaring you, than actually teaching you Chemistry. It's all self-taught. Most of my dissucsion class walked away with a D.",1.0,Tough Grader|TEST HEAVY
Don Decoste,"Don is such a great professor!  You can tell how much he genuinely cares that his students are learning, and he is very enthusiastic about teaching.  He answers questions well and is always very organized.  However, exams are painfully difficult.  You need to study a lot to do well.",5.0,Tough Grader|TEST HEAVY|Amazing lectures
Gary Dell,"Took his class Fall 2018, ever since he has still remained one of my favourite lecturers. The content he teaches is interesting and the way he delivers his lecturers is informative and humorous. His dry wit and the fact he is a fellow Canadian make him my favs.",5.0,Skip class? You won't pass.|Amazing lectures
Gary Dell,"His lectures are super interesting. At first I was't too keen about taking his class but he is turning out to be my favourite professor. He is knowledgeable in his field and he always makes class interactive. However, without going for lecture, his slides will be very difficult to understand. The exams are hard but they are curved heavily (19/31A)",5.0,Respected|Skip class? You won't pass.|Amazing lectures
Gary Dell,Posts the slides online but you have to go to class in order to understand the concepts fully. 3 exams that are application-based so you have to really know the material. Made lectures fun and interesting and sometimes would get off topic but would keep the class engaged with his humor. Unique grading scale!,4.0,Inspirational|Amazing lectures
Robert Lee Deville,DeVille is the best professor I've ever had and possibly will ever have. His grading criteria is very clear and there's no room for confusion in how anything's done. Study the homework solutions since the midterms and finals are based on them. Always available by office hours or email. I'll be blessed if I ever get to take another course with him.,5.0,Gives good feedback|Skip class? You won't pass.|GRADED BY FEW THINGS
Robert Lee Deville,"DeVille was my first math professor I had during my career at UIUC, and I couldn't be happier I had the privilege to be in his class. He demonstrated complete understanding of material covered in expansive detail, if you're confused about something, he'll find a way to explain it. He's also humorous, making his lectures a pleasure to attend",5.0,Respected|Inspirational|Amazing lectures
Robert Lee Deville,This guy is the an amazing teacher. For me he was the best teacher first semester. His lectures are very organized and clear. He does an amazing job of teaching and lectures are very worthwhile to attend. You want Lee Deville for Calc 231.,5.0,Skip class? You won't pass.|LOTS OF HOMEWORK|Amazing lectures
Robert Lee Deville,"DeVille is a mathematical god. His explanations are very in-depth (can get a little confusing) but overall its incredibly clear and the webassigns that go along with it help you perfect your knowledge of Calc 2. Extremely caring of his students, always there to help. Midterms aren't super easy (average around a 75) but super easy final.",5.0,Gives good feedback|Hilarious|Caring
Robert Lee Deville,"He's an amazing professor, math 231 is hard but he makes it as easy as possible while still making sure that you learn.",5.0,Gives good feedback|Skip class? You won't pass.|Caring
Robert Lee Deville,"He is a great lecturer, makes you work for your grade- challenge problems frequently in homework",4.0,Skip class? You won't pass.|ACCESSIBLE OUTSIDE CLASS|Amazing lectures
Robert Lee Deville,"Very very good teacher. Class is run extremely well, and DeVille is a very humorous and approachable guy. Definitely knows his stuff too. Homework is a nightmare though; this is an extremely difficult class, especially if youre in the engineering sections. WebAssign is relatively easy; weekly worksheets require a great deal of thought.",5.0,LOTS OF HOMEWORK|Hilarious|Amazing lectures
Robert Lee Deville,"Lee DeVille is a great math professor. He is very reasonable, funny, and extremely easy to understand. He gives great lectures. The engineering math is different and makes for lots of work, but he is great about answering all the questions he can. He is very easy to approach and tried to learn all the 300 kids' names in my class. I recommend him.",5.0,Respected|LOTS OF HOMEWORK|Caring
Isaac Dilanni,"Took this class FA20. Lectures were partially written, partially recorded, and concepts aren't too tricky, even as someone who has never taken an Econ course before. Discussions are helpful. Not mandatory, but I would still recommend as it's nice to ask questions/clarify some things. Overall a solid class.",4.0,Clear grading criteria
Isaac Dilanni,I took this SP21 online. Discussion is only for your benefit and you don't have to attend. All you have to do is read the weekly material and take the homeworks and quizzes. He seems to really love the material. You don't really have to have a good understanding of the material to do it. There are 3 exams and a final. None are proctored.,4.0,Get ready to read
Isaac Dilanni,"He was a good professor. His lectures were all slides on Compass, but he explained the purpose and concepts in well detail and if you didn't understand, you could pop into office hours and he would explain it until you understood. He also offers extra credit opportunities here and there, including a syllabus quiz at the beginning of the semester.",4.0,Respected|Clear grading criteria|Lecture heavy
Isaac Dilanni,"Easiest class I've ever taken. Probably could have finished the entire class in a day. Still, lectures were interesting and material was laid out well. Grading policies were very fair. Never showed up for discussion and still got A+ on all the midterms.",5.0,Respected|Get ready to read|Clear grading criteria
Isaac Dilanni,"This is my third time taking Isaac, but my first time taking him for an in-person. We had biweekly papers, seven in total. Not many people showed up to class but I found the lectures really interesting. He seemed really interested in what he was teaching and spent a good amount of time explaining underappreciated parts of American Economic History.",5.0,Respected|Amazing lectures|So many papers
Isaac Dilanni,Lectures are written out and you read the content each week. Not many communications from the professor other than the lecture intro videos. Discussion is optional.,2.0,Lots of homework|Get ready to read|Test heavy
Isaac Dilanni,I had prof. dilanni for Econ 102 and 302 and he made both classes interesting and engaging without being too difficult and adapted the class well to the virtual environment.,5.0,Gives good feedback
Isaac Dilanni,"Three midterms and one final- plus weekly homework that was like six multiple-choice questions, as well as a ton of modules that had quizzes. I believe I did the weekly homework and the midterms, as well as the final which replaced all of the grades for the module based quizzes. Not much studying is necessary with a background in economics.",5.0,Accessible outside class|Graded by few things|Caring
Isaac Dilanni,Amazing,5.0,Respected|Get ready to read|Caring
Isaac Dilanni,"His online course was very well structured and easy to follow. Granted it was an introductory course, it was still a smooth experience.",5.0,Accessible outside class|Clear grading criteria
Isaac Dilanni,DiIanni teaches this class so well. Econ is a breeze with him. He has his own typed up chapters to take notes from which are very clear and great for explaining the concepts. Each chapter has a HW & quiz that allow multiple attempts. 70% of grade is exams but they're not bad and give you more than enough time. A very caring and passionate prof!,5.0,Accessible outside class|Test heavy|Caring
Isaac Dilanni,You can easily tell that this professor is passionate about what he is teaching. His lectures are easy to follow and he gives plenty of good analogies to help you understand difficult concepts. He is very fair in the types of questions he asks in homework and quizzes. I would definitely take a class with him again in the future!,5.0,Respected|Inspirational|Amazing lectures
Isaac Dilanni,"- Compared to Vasquez, yes, Diianni's class is much harder, but actually learning the content in ECON102 makes other classes much easier (good fundamentals) - BUY THE CUSTOM TEXTBOOK. Easily the best investment I have made in college, with tests from previous semesters (many repeated questions) and step-by-step solutions to walk through problems",5.0,Respected|Skip class? You won't pass.|Test heavy
Isaac Dilanni,"Diianni was an amazing professor for ECON102. His custom workbook was super helpful in preparing for his exams. Attendance isn't mandatory, but going to class made studying so much easier. He explains everything clearly and provides so many examples. I learned a lot and I definitely recommend taking his class!",5.0,Skip class? You won't pass.|Test heavy|Amazing lectures
Isaac Dilanni,"Prof. DiIanni teaches really well. He is prepared for each lecture, and he can explain clearly. Textbook is not really required, as no readings will be tested. But some discussion readings will be quizzed, and they're unrelated to lecture materials! Three midterms, not too hard, if you study for practice problems in the workbook. Buy the workbook!",5.0,Respected|Skip class? You won't pass.|Amazing lectures
Isaac Dilanni,"Amazing lecturer! One of the best profs at UIUC. He is so knowledgable and passionate about econ. Definitely buy the workbook, it's an absolute lifesaver! Tests are straightforward. You must go to every single lecture and pay attention to understand the material. Discussion sessions are useful. Don't miss the online quizzes!",5.0,Respected|Skip class? You won't pass.|Amazing lectures
Isaac Dilanni,"Best professor ever, he has some humor as well, the workbook helped a great deal. I wasn't that good at his class but it was interesting, I learned a lot and I would take it again!",4.0,Respected|Inspirational|Clear grading criteria
Isaac Dilanni,"He is a great professor and is amazing at teaching econ. He is willing to help his students if they are struggling. Going to lecture and paying attention is #1 priority. Go to lecture, pay attention, write down definitions given, and get an easy A/B",5.0,Respected|Skip class? You won't pass.|Amazing lectures
Isaac Dilanni,Prof. DiIanni is one of my favorite professors on this campus! I had him for 102 and then chose to take him again for 302. He's really great at explaining and is very approachable. You can tell he has a passion for teaching and economics. I wish I could take more classes with him!!,5.0,Respected|Graded by few things|Caring
Isaac Dilanni,"Isaac is a great professor, I really enjoyed his lectures! Really cool guy go to office hours and I recommend getting the workbook for his class, super helpful!",4.0,Test heavy|Clear grading criteria
Isaac Dilanni,Amazing professor. Lectures clearly explain important concepts. Exams are very straight forward and based on completely on content reviewed in lectures or through online quizzes. Skip Vasquez and take Dilanni if you're a business major and actually need an adequate foundation in econ for upper-level classes.,5.0,Respected|Clear grading criteria|Amazing lectures
Isaac Dilanni,"Dilanni is a great econ professor. Attendance was not mandatory for lectures but, you will not understand the material in discussions or during exams if you don't go. The optional workbook is an absolute lifesaver and definitely worth the money. The workbook has three practice exams for each test and are very similar to the ones he'll give you.",5.0,Respected|Skip class? You won't pass.|Amazing lectures
Isaac Dilanni,"DiIanni is awesome. He makes the material very easy to understand and provides tons of examples. As long as you attend lectures and do the practice problems, you'll be fine. I have heard for this class, though, Vazquez is much much easier but DiIanni is a better teacher. I would definitely take this class with him again.",5.0,Inspirational|Amazing lectures|Caring
Isaac Dilanni,Easy class! Exams are simple if you retake the practice quizzes and buy the optional workbook (almost all the test questions come from these two sources). DiIanni is very knowledgeable and truly cares about whether his students understand the material or not. Lectures are interesting and his real-world examples help so much.,5.0,ACCESSIBLE OUTSIDE CLASS|Clear grading criteria|Amazing lectures
Isaac Dilanni,Best Economics professor I've ever had. He explains concepts in such a crystal-clear way and is fun to talk to outside of class is well! The exams are tough but the quizzes are super easy (answers are online). 10/10 would take again.,5.0,Skip class? You won't pass.|ACCESSIBLE OUTSIDE CLASS|Amazing lectures
Isaac Dilanni,"A wonderful person and even better professor. This class was so enjoyable not only because of the material, but the way in which it was delivered. You really can't go wrong with DiIanni.",5.0,Respected|Inspirational|EXTRA CREDIT
Isaac Dilanni,"Best dressed professor on campus. Very relevant material, even though he's often outspoken. Very calm and well-prepared. Knows how to deal with a lot of nonsense.",5.0,Respected|Clear grading criteria|Caring
Isaac Dilanni,He's just awesome and very inspirational. Highly recommended if you want to learn.,5.0,Respected|Inspirational|Would take again
Isaac Dilanni,"Econ-302 with him is neither the hardest nor the easiest class that I have taken. Professor Dianni is an excellent teacher and he is very knowledgeable about economic issues. He is also very approachable to students, but he has very strong opinions on economic issues, opinions with which some students might disagree.",5.0,Participation matters|Inspirational|TEST HEAVY
Isaac Dilanni,Very approachable. Gives a different insight into economic thinking than most professors offer. Challenges and expands your own thinking.,5.0,Skip class? You won't pass.|Clear grading criteria|Gives good feedback
Isaac Dilanni,"Diianni is a great professor and clearly a great guy. He knows so much about the world of Economics and is great at giving real life examples to explain the material taught in class. The class, however, is quite difficult. The exams are similar to the previous exams, but a few questions tripped me up. The final exam my semester was extremely hard.",5.0,TEST HEAVY|GRADED BY FEW THINGS|LECTURE HEAVY
Isaac Dilanni,"ECON 102 was fairly easy, if you buy the workbook and do the old exams then the actual ones are very similar. You can tell that DiIanni is very passionate about the subject, however lectures could get a little boring. Basically as long as you do the work book then you should get an A, don't bother getting the actual textbook",4.0,Clear grading criteria|TEST HEAVY|GRADED BY FEW THINGS
Isaac Dilanni,"There's 3 midterms and a final. DiIanni is super chill, so you can skip any (or all) of the midterms, and the weight of that exam will be put on your final. He also gives past exams and how to do math problems in his workbook, so you don't really need to go to class (but graphs aren't provided). He offers a good amount of extra credit too!",5.0,Respected|Inspirational|Caring
Isaac Dilanni,"I thought his lectures drug on and on. While he certainly is brilliant, he has a tendency to over-explain simple topics to the point of confusing. The flip-side is that he loves to help students during office hours. A little pompous, but overall a good guy. Avoid him at the sub-400 level; take him for 400-level courses. He's much better there.",4.0,Skip class? You won't pass.|GRADED BY FEW THINGS|LECTURE HEAVY
Isaac Dilanni,"Professor DiIanni is a gifted lecturer and knowledgeable on many economic topics. He explains concepts and answers questions clearly and effectively. ECON 102 is a breeze so long as you review the previous years' exam solutions, which are readily available in your course packet. His impeccable wardrobe is also a plus.",5.0,Respected|Clear grading criteria|LECTURE HEAVY
Isaac Dilanni,"Great professor lots of freedom of attendance, exams, quizzes, and discussions. Not boring at all so focusing won't be a problem. Should pass the class with an A or B anything less is just piss poor effort.",5.0,Respected|Clear grading criteria|Amazing lectures
Isaac Dilanni,"Spends a bit of time debunking liberal myths ('There are more poor people in US than in Europe', 'labor unions are good' etc.). One point extra credit for taking a survey or something. Honestly most of it is just simple math, some intuition and definitions. You can skip midterms and get the weight shifted (beware). Use the workbook and pract. exams",5.0,Respected|ACCESSIBLE OUTSIDE CLASS|EXTRA CREDIT
Isaac Dilanni,Great professor! Great lecturer! Make you interested in Econ!,5.0,Gives good feedback|Respected|LECTURE HEAVY
Isaac Dilanni,"Have a lot of respect for this guy.  The class is't bad.  He provides a workbook which has everything you need to know and practice exams.  Its not a complete easy A, but if you do the workbook, you will be set.  Lectures are pretty important but he posts his power points online too.  Discussions don't matter- only good for extra points.",5.0,Respected|Clear grading criteria|LECTURE HEAVY
